{
  "$schema": "https://json-schema.org/draft/2020-12/schema",
  "type": "object",
  "properties": {
    "id": {
      "type": "string",
      "pattern": "^[A-Za-z0-9][A-Za-z0-9_.-]{0,127}$"
    },
    "kind": {
      "enum": [
        "orchestration",
        "persona",
        "skill",
        "runtime"
      ]
    },
    "version": {
      "type": "string",
      "minLength": 1
    },
    "status": {
      "enum": [
        "released",
        "provisional"
      ]
    },
    "description": {
      "type": "string",
      "minLength": 1
    },
    "capabilities": {
      "type": "array",
      "items": {
        "type": "string",
        "minLength": 1
      },
      "minItems": 0
    },
    "requires": {
      "type": "array",
      "items": {
        "type": "string",
        "minLength": 1
      },
      "minItems": 0
    },
    "entrypoint": {
      "type": "string",
      "minLength": 1
    }
  },
  "required": [
    "id",
    "kind",
    "version",
    "status",
    "description",
    "capabilities",
    "requires",
    "entrypoint"
  ],
  "additionalProperties": true
}
